{
  "schemaVersion": "1.0.0",
  "objective": "동일 입력 검사를 반복하지 않는다.",
  "expectedBehavior": "권한 확인 뒤 새 관측을 얻는다.",
  "episodes": [
    { "attemptId": "one", "operation": "build", "stableFailureTuple": { "errorCode": "EACCES" }, "environmentDigest": "env:local", "changeSummary": "", "evidenceRefs": ["logs/one.txt"] }
  ],
  "lastKnownGood": null,
  "constraints": [],
  "authorization": { "allowedChecks": ["check-acl"], "approvalRequired": [], "prohibitedChecks": [] },
  "attemptedChecks": [{ "checkId": "check-acl", "inputDigest": "input:same", "resultDigest": "result:old" }],
  "candidateHypotheses": [
    { "id": "H1", "causalLayer": "permission", "statement": "ACL 문제다.", "supportingEvidence": [], "contradictingEvidence": [], "state": "open" },
    { "id": "H2", "causalLayer": "state", "statement": "파일 잠금 문제다.", "supportingEvidence": [], "contradictingEvidence": [], "state": "open" }
  ],
  "candidateTests": [
    {
      "checkId": "check-acl",
      "question": "ACL을 다시 확인한다.",
      "preconditions": [],
      "risk": "read-only",
      "requiredAuthorization": [],
      "outcomes": [
        { "observation": "권한 없음", "supportsHypotheses": ["H1"], "refutesHypotheses": ["H2"] },
        { "observation": "권한 있음", "supportsHypotheses": ["H2"], "refutesHypotheses": ["H1"] }
      ],
      "stopCondition": "한 번 확인 후 중단한다.",
      "informationGain": 4,
      "cost": 1,
      "inputDigest": "input:same"
    }
  ],
  "accessBlockers": []
}
